"incident_id","operation_name","incident_title","date","incident_type","strike_type","confirmed","origin_lat","origin_lng","origin_label","origin_sublabel","target_lat","target_lng","target_label","target_sublabel","summary","target_type","platform_or_unit","result_outcome","tags","source_type","is_retaliation","is_covert","is_first_use","disputed"
"tw-20260227234002-iran-unk","Independent Actions","Trump says Iran is trying to rebuild its nuclear program and working on…","Feb 27, 2026","strike","nuclear","FALSE","","","","","32.0","53.0","Iran","","Trump says Iran is trying to rebuild its nuclear program and working on developing missiles that could soon reach the US homeland","Nuclear facility","Strike Aircraft / Cruise Missile","","IR;IRAN;NUCLEAR;US","enriched","FALSE","FALSE","FALSE","FALSE"
"tw-20260227234002-iran-iranre","Iran Retaliation","Trump says the US will 'raze' Iran's missile industry and 'annihilate' their navy","Feb 27, 2026","strike","naval","FALSE","32.0","53.0","Iran / Proxy Forces","IRGC launch sites","32.0","53.0","Iran","","Trump says the US will 'raze' Iran's missile industry and 'annihilate' their navy","Military target","Naval Vessel","","IR;IRAN;IRAN-RETALIATION;NAVAL;US","enriched","FALSE","FALSE","FALSE","FALSE"
"tw-20260227234002-iran-iranre-1","Iran Retaliation","Trump says Iran's missile industry will be 'totally obliterated","Feb 27, 2026","strike","missile","FALSE","32.0","53.0","Iran / Proxy Forces","IRGC launch sites","32.0","53.0","Iran","","Trump says Iran's missile industry will be 'totally obliterated'","Area / Infrastructure","Ballistic / Cruise Missile","","IR;IRAN;IRAN-RETALIATION;MISSILE","enriched","FALSE","FALSE","FALSE","FALSE"
"tw-20260227234003-iran-unk","Independent Actions","Iranian media says that missiles targeted the Supreme Leader's compound","Feb 27, 2026","strike","missile","FALSE","","","","","32.0","53.0","Iran","","Iranian media says that missiles targeted the Supreme Leader's compound","Area / Infrastructure","Ballistic / Cruise Missile","","IR;IRAN;MISSILE","enriched","FALSE","FALSE","FALSE","FALSE"
"tw-20260227234003-iran-unk-1","Independent Actions","Trump announces strikes against Iran","Feb 27, 2026","strike","strike","FALSE","","","","","32.0","53.0","Iran","","Trump announces strikes against Iran, says goal is to eliminate imminent threats.","Military target","","","IR;IRAN;STRIKE","enriched","FALSE","FALSE","FALSE","FALSE"
"tw-20260228000003-iran-iranre","Iran Retaliation","New York Times reports Israel will focus on Iran's 'missile storage sites","Feb 28, 2026","strike","nuclear","FALSE","32.0","53.0","Iran / Proxy Forces","IRGC launch sites","32.0","53.0","Iran","","New York Times reports Israel will focus on Iran's 'missile storage sites, production facilities and launchers' while the US is expected to focus on 'the Iranian nuclear project and additional targets","Nuclear facility","Strike Aircraft / Cruise Missile","","IR;IRAN;IRAN-RETALIATION;ISRAEL;NUCLEAR;US","enriched","FALSE","FALSE","FALSE","FALSE"
"tw-20260228001003-iran-iranre","Iran Retaliation","Alerts in Israel of Iranian missile launches","Feb 28, 2026","strike","missile","FALSE","32.0","53.0","Iran / Proxy Forces","IRGC launch sites","32.0","53.0","Iran","","Alerts in Israel of Iranian missile launches","Area / Infrastructure","Ballistic / Cruise Missile","","IR;IRAN;IRAN-RETALIATION;ISRAEL;MISSILE","enriched","FALSE","FALSE","FALSE","FALSE"
"tw-20260228001003-israel-iranre","Iran Retaliation","Iran has launched missiles towards Israel","Feb 28, 2026","strike","missile","FALSE","32.0","53.0","Iran / Proxy Forces","IRGC launch sites","31.5","34.9","Israel","","Iran has launched missiles towards Israel","Area / Infrastructure","Ballistic / Cruise Missile","","IL;IRAN;IRAN-RETALIATION;ISRAEL;MISSILE","enriched","FALSE","FALSE","FALSE","FALSE"
"tw-20260228002003-iran-iranre","Iran Retaliation","Sirens heard in northern Israel amid incoming Iranian missile attack","Feb 28, 2026","strike","missile","FALSE","32.0","53.0","Iran / Proxy Forces","IRGC launch sites","32.0","53.0","Iran","","Sirens heard in northern Israel amid incoming Iranian missile attack","Area / Infrastructure","Ballistic / Cruise Missile","","IR;IRAN;IRAN-RETALIATION;ISRAEL;MISSILE","enriched","FALSE","FALSE","FALSE","FALSE"
"tw-20260228002003-netanya-12dayw","12-Day War (IDF)","Netanyahu says US and Israel are conducting an operation to remove the…","Feb 28, 2026","strike","strike","FALSE","31.9","34.8","Israel (IAF)","Israeli Air Force bases","32.33","34.86","Netanya","","Netanyahu says US and Israel are conducting an operation to remove the existential threat coming from Iran","Military target","","","12-DAY-WAR-(IDF);IL;IRAN;ISRAEL;NETANYA;STRIKE;US","enriched","FALSE","FALSE","FALSE","FALSE"
"tw-20260228003003-tehran-opepic","Op. Epic Fury","New strikes on targets in Tehran","Feb 28, 2026","strike","strike","FALSE","-7.32","72.42","Diego Garcia BIOT","US/UK forward base","35.69","51.39","Tehran","","New strikes on targets in Tehran","Military target","","","IR;OP-EPIC-FURY;STRIKE;TEHRAN","enriched","FALSE","FALSE","FALSE","FALSE"
"tw-20260228004003-iran-opepic","Op. Epic Fury","US names campaign against Iran","Feb 28, 2026","strike","strike","FALSE","-7.32","72.42","Diego Garcia BIOT","US/UK forward base","32.0","53.0","Iran","","US names campaign against Iran, 'Operation Epic Fury'.","Military target","","","IR;IRAN;OP-EPIC-FURY;STRIKE;US","enriched","FALSE","FALSE","FALSE","FALSE"
"tw-20260228005001-red-sea-houthi","Houthi / Proxies","Yemen's Houthis announce they will resume attacks in the Red Sea","Feb 28, 2026","strike","strike","FALSE","15.37","44.19","Yemen (Houthi)","Sana'a / Hodeidah","20.0","38.5","Red Sea","","Yemen's Houthis announce they will resume attacks in the Red Sea","Military target","","","HOUTHI-/-PROXIES;RED-SEA;STRIKE;YE","enriched","FALSE","FALSE","FALSE","FALSE"
"tw-20260228011002-bahrain-unk","Independent Actions","Explosions in Bahrain","Feb 28, 2026","strike","strike","FALSE","","","","","26.07","50.55","Bahrain","","Explosions in Bahrain","Military target","","","BAHRAIN;BH;STRIKE","enriched","FALSE","FALSE","FALSE","FALSE"
"tw-20260228011002-iran-iranre","Iran Retaliation","Explosion in Bahrain appears to be due to Iranian missile","Feb 28, 2026","strike","missile","FALSE","32.0","53.0","Iran / Proxy Forces","IRGC launch sites","32.0","53.0","Iran","","Explosion in Bahrain appears to be due to Iranian missile","Area / Infrastructure","Ballistic / Cruise Missile","","IR;IRAN;IRAN-RETALIATION;MISSILE","enriched","FALSE","FALSE","FALSE","FALSE"
"tw-20260228013002-abu-dhabi-unk","Independent Actions","Blasts heard in Abu Dhabi","Feb 28, 2026","strike","missile","FALSE","","","","","24.45","54.37","Abu Dhabi","","Blasts heard in Abu Dhabi, appear to be due to interception.","Area / Infrastructure","Ballistic / Cruise Missile","","ABU-DHABI;AE;MISSILE","enriched","FALSE","FALSE","FALSE","FALSE"
"tw-20260228013002-iraq-unk","Independent Actions","Reports of strikes in Iraq","Feb 28, 2026","strike","strike","FALSE","","","","","33.0","44.0","Iraq","","Reports of strikes in Iraq","Naval facility","","","IQ;IRAQ;STRIKE","enriched","FALSE","FALSE","FALSE","TRUE"
"tw-20260228013002-iran-unk","Independent Actions","Strikes against targets in western Iran","Feb 28, 2026","strike","strike","FALSE","","","","","32.0","53.0","Iran","","Strikes against targets in western Iran","Military target","","","IR;IRAN;STRIKE","enriched","FALSE","FALSE","FALSE","FALSE"
"tw-20260228014003-bahrain-unk","Independent Actions","New blasts in Bahrain","Feb 28, 2026","strike","strike","FALSE","","","","","26.07","50.55","Bahrain","","New blasts in Bahrain","Military target","","","BAHRAIN;BH;STRIKE","enriched","FALSE","FALSE","FALSE","FALSE"
"tw-20260228015002-riyadh-unk","Independent Actions","Blasts heard in Riyadh","Feb 28, 2026","strike","strike","FALSE","","","","","24.69","46.72","Riyadh","","Blasts heard in Riyadh, cause unclear.","Military target","","","RIYADH;SA;STRIKE","enriched","FALSE","FALSE","FALSE","TRUE"
"tw-20260228020003-israel-unk","Independent Actions","BREKAING: IDF has conducted strikes against political leaders including Supreme…","Feb 28, 2026","strike","strike","FALSE","","","","","31.5","34.9","Israel","","BREKAING: IDF has conducted strikes against political leaders including Supreme Leader Khamenei and President Pezeshkian, according to Axios report.","Naval facility","","","IDF;IL;ISRAEL;STRIKE","enriched","FALSE","FALSE","FALSE","FALSE"
"tw-20260228020004-dubai-unk","Independent Actions","Blast heard in Dubai","Feb 28, 2026","strike","strike","FALSE","","","","","25.2","55.27","Dubai","","Blast heard in Dubai, cause unclear.","Military target","","","AE;DUBAI;STRIKE","enriched","FALSE","FALSE","FALSE","TRUE"
"tw-20260228021002-iran-unk","Independent Actions","Strikes against pro-Iran militias in Iraq","Feb 28, 2026","strike","strike","FALSE","","","","","32.0","53.0","Iran","","Strikes against pro-Iran militias in Iraq","Military target","","","IR;IRAN;STRIKE","enriched","FALSE","FALSE","FALSE","FALSE"
"tw-20260228021003-abu-dhabi-iranre","Iran Retaliation","UAE says falling Iranian missile debris fell in residential areas in Abu Dhabi…","Feb 28, 2026","strike","missile","FALSE","32.0","53.0","Iran / Proxy Forces","IRGC launch sites","24.45","54.37","Abu Dhabi","","UAE says falling Iranian missile debris fell in residential areas in Abu Dhabi and that the attack violated sovereignty and the UAE reserves right to respond.","Area / Infrastructure","Ballistic / Cruise Missile","","ABU-DHABI;AE;IRAN-RETALIATION;MISSILE","enriched","FALSE","FALSE","FALSE","FALSE"
"tw-20260228021003-iran-12dayw","12-Day War (IDF)","Israeli media reports that security sources assess 'major success' in targeted…","Feb 28, 2026","strike","naval","FALSE","31.9","34.8","Israel (IAF)","Israeli Air Force bases","32.0","53.0","Iran","","Israeli media reports that security sources assess 'major success' in targeted assassinations against Iranian political and military leadership","Naval facility","Naval Vessel","","12-DAY-WAR-(IDF);IR;IRAN;NAVAL","enriched","FALSE","FALSE","FALSE","FALSE"
"tw-20260228022003-iran-iranre","Iran Retaliation","Jordan says it shot down two Iranian ballistic missiles","Feb 28, 2026","economic","missile","FALSE","32.0","53.0","Iran / Proxy Forces","IRGC launch sites","32.0","53.0","Iran","","Jordan says it shot down two Iranian ballistic missiles","Area / Infrastructure","Ballistic / Cruise Missile","","IR;IRAN;IRAN-RETALIATION;MISSILE","enriched","FALSE","FALSE","FALSE","FALSE"
"tw-20260228023002-israel-unk","Independent Actions","Israeli military will call up 70,000 reserve soldiers","Feb 28, 2026","strike","strike","FALSE","","","","","31.5","34.9","Israel","","Israeli military will call up 70,000 reserve soldiers","Military target","","","IL;ISRAEL;STRIKE","enriched","FALSE","FALSE","FALSE","FALSE"
"tw-20260228023002-iran-iranre","Iran Retaliation","Iran launches new wave of missile attacks","Feb 28, 2026","strike","missile","FALSE","32.0","53.0","Iran / Proxy Forces","IRGC launch sites","32.0","53.0","Iran","","Iran launches new wave of missile attacks","Area / Infrastructure","Ballistic / Cruise Missile","","IR;IRAN;IRAN-RETALIATION;MISSILE","enriched","FALSE","FALSE","FALSE","FALSE"
"tw-20260228023002-iraq-unk","Independent Actions","Attack on US base in Iraqi Kurdistan","Feb 28, 2026","strike","strike","FALSE","","","","","33.0","44.0","Iraq","","Attack on US base in Iraqi Kurdistan","Military target","","","IQ;IRAQ;STRIKE;US","enriched","FALSE","FALSE","FALSE","FALSE"
"tw-20260228024003-abu-dhabi-unk","Independent Actions","Several blasts heard near Abu Dhabi airport","Feb 28, 2026","strike","strike","FALSE","","","","","24.45","54.37","Abu Dhabi","","Several blasts heard near Abu Dhabi airport, cause unclear.","Naval facility","","","ABU-DHABI;AE;STRIKE","enriched","FALSE","FALSE","FALSE","TRUE"
"tw-20260228025002-iran-unk","Independent Actions","Australia expresses support for US operation against Iran","Feb 28, 2026","strike","strike","FALSE","","","","","32.0","53.0","Iran","","Australia expresses support for US operation against Iran","Naval facility","","","IR;IRAN;STRIKE;US","enriched","FALSE","FALSE","FALSE","FALSE"
"tw-20260228030003-iran-unk","Independent Actions","Reports of strike near the residence of Iran’s former president","Feb 28, 2026","strike","strike","FALSE","","","","","32.0","53.0","Iran","","Reports of strike near the residence of Iran’s former president, Mahmoud Ahmadinejad.","Naval facility","","","IR;IRAN;STRIKE","enriched","FALSE","FALSE","FALSE","TRUE"
"tw-20260228031002-iran-12dayw","12-Day War (IDF)","Israeli official says military is trying to create conditions for the downfall of…","Feb 28, 2026","economic","naval","FALSE","31.9","34.8","Israel (IAF)","Israeli Air Force bases","32.0","53.0","Iran","","Israeli official says military is trying to create conditions for the downfall of the regime and is 'targeting the entire Iranian leadership - political and military - past, present, and future', acco","Naval vessel","Naval Vessel","","12-DAY-WAR-(IDF);IR;IRAN;NAVAL","enriched","FALSE","FALSE","FALSE","FALSE"
"tw-20260228035002-abu-dhabi-unk","Independent Actions","New blasts heard in Doha and Abu Dhabi","Feb 28, 2026","strike","strike","FALSE","","","","","24.45","54.37","Abu Dhabi","","New blasts heard in Doha and Abu Dhabi, cause unclear.","Military target","","","ABU-DHABI;AE;STRIKE","enriched","FALSE","FALSE","FALSE","TRUE"
"tw-20260228040003-iran-unk","Independent Actions","UAE has intercepted a new wave of Iranian missiles","Feb 28, 2026","strike","missile","FALSE","","","","","32.0","53.0","Iran","","UAE has intercepted a new wave of Iranian missiles","Area / Infrastructure","Ballistic / Cruise Missile","","IR;IRAN;MISSILE","enriched","FALSE","FALSE","FALSE","FALSE"
"tw-20260228094005-israel-iranre","Iran Retaliation","Iran launches new wave of missiles towards Israel","Feb 28, 2026","strike","missile","FALSE","32.0","53.0","Iran / Proxy Forces","IRGC launch sites","31.5","34.9","Israel","","Iran launches new wave of missiles towards Israel","Area / Infrastructure","Ballistic / Cruise Missile","","IL;IRAN;IRAN-RETALIATION;ISRAEL;MISSILE","enriched","FALSE","FALSE","FALSE","FALSE"
"tw-20260228094005-israel-unk","Independent Actions","Israeli military says it conducted the biggest airstrike in its history with the…","Feb 28, 2026","strike","fighter","FALSE","","","","","31.5","34.9","Israel","","Israeli military says it conducted the biggest airstrike in its history with the involvement of around 200 fighter jets striking 500 targets","Military target","Multi-role Fighter Aircraft","","FIGHTER;IL;ISRAEL","enriched","FALSE","FALSE","FALSE","FALSE"
"tw-20260228095003-strait-of-ho-unk","Independent Actions","BREKAING: US Transport Department calls on commercial vessels to avoid the Strait…","Feb 28, 2026","strike","naval","FALSE","","","","","26.56","56.25","Strait of Hormuz","","BREKAING: US Transport Department calls on commercial vessels to avoid the Strait of Hormuz","Naval facility","Naval Vessel","","IR;NAVAL;STRAIT-OF-HORMUZ;US","enriched","FALSE","FALSE","FALSE","FALSE"
"tw-20260228095003-iran-iranre","Iran Retaliation","Turkey's President Erdogan says Iranian drone and missile attacks against Gulf…","Feb 28, 2026","strike","missile","FALSE","32.0","53.0","Iran / Proxy Forces","IRGC launch sites","32.0","53.0","Iran","","Turkey's President Erdogan says Iranian drone and missile attacks against Gulf countries are 'unacceptable'","Drone / UAV","UAV / Drone","","IR;IRAN;IRAN-RETALIATION;MISSILE","enriched","FALSE","FALSE","FALSE","FALSE"
"tw-20260228100002-kuwait-city-unk","Independent Actions","Air defences intercept missiles over Kuwait","Feb 28, 2026","strike","missile","FALSE","","","","","29.37","47.98","Kuwait City","","Air defences intercept missiles over Kuwait","Area / Infrastructure","Ballistic / Cruise Missile","","KUWAIT-CITY;KW;MISSILE","enriched","FALSE","FALSE","FALSE","FALSE"
"tw-20260228102002-iran-unk","Independent Actions","30 missiles were dropped on the Iranian Supreme Leader's compound and Khamenei is…","Feb 28, 2026","strike","missile","FALSE","","","","","32.0","53.0","Iran","","30 missiles were dropped on the Iranian Supreme Leader's compound and Khamenei is 'almost certainly' dead, according to Israel's Channel 12.","Area / Infrastructure","Ballistic / Cruise Missile","","IR;IRAN;ISRAEL;MISSILE","enriched","FALSE","FALSE","FALSE","FALSE"
"tw-20260228102002-iran-iranre","Iran Retaliation","US military says it defended against hundreds of Iranian missile and drone attacks","Feb 28, 2026","strike","missile","FALSE","32.0","53.0","Iran / Proxy Forces","IRGC launch sites","32.0","53.0","Iran","","US military says it defended against hundreds of Iranian missile and drone attacks","Drone / UAV","UAV / Drone","","IR;IRAN;IRAN-RETALIATION;MISSILE;US","enriched","FALSE","FALSE","FALSE","FALSE"
"tw-20260228103003-iran-unk","Independent Actions","New York City Mayor Zohran Mamdani says strikes on Iran are 'a catastrophic…","Feb 28, 2026","strike","strike","FALSE","","","","","32.0","53.0","Iran","","New York City Mayor Zohran Mamdani says strikes on Iran are 'a catastrophic escalation in an illegal war of aggression' and that 'Americans do not want this. They do not want another war in pursuit of","Military target","","","IR;IRAN;STRIKE","enriched","FALSE","FALSE","FALSE","FALSE"
"tw-20260228104002-iran-unk","Independent Actions","The US military says damage from Iranian attacks have been minimal and no US…","Feb 28, 2026","strike","strike","FALSE","","","","","32.0","53.0","Iran","","The US military says damage from Iranian attacks have been minimal and no US personnel have been killed.","Military target","","","IR;IRAN;STRIKE;US","enriched","FALSE","FALSE","FALSE","FALSE"
"tw-20260228110004-kuwait-city-iranre","Iran Retaliation","Kuwait has summoned Iran's ambassador over missile strikes","Feb 28, 2026","strike","missile","FALSE","32.0","53.0","Iran / Proxy Forces","IRGC launch sites","29.37","47.98","Kuwait City","","Kuwait has summoned Iran's ambassador over missile strikes","Area / Infrastructure","Ballistic / Cruise Missile","","IRAN;IRAN-RETALIATION;KUWAIT-CITY;KW;MISSILE","enriched","FALSE","FALSE","FALSE","FALSE"
"tw-20260228111003-bahrain-unk","Independent Actions","New blasts heard in Bahrain","Feb 28, 2026","strike","strike","FALSE","","","","","26.07","50.55","Bahrain","","New blasts heard in Bahrain","Military target","","","BAHRAIN;BH;STRIKE","enriched","FALSE","FALSE","FALSE","FALSE"
"tw-20260228112002-strait-of-ho-opepic","Op. Epic Fury","MIDDLE EAST - Netanyahu says many signs that Iran's Supreme Leader has been…","Feb 28, 2026","strike","naval","FALSE","-7.32","72.42","Diego Garcia BIOT","US/UK forward base","26.56","56.25","Strait of Hormuz","","MIDDLE EAST - Netanyahu says many signs that Iran's Supreme Leader has been eliminated - Iran says he is safe and in command - US says it has suffered no casualties so far - Ongoing Iranian missile an","Military base / C2","Naval Vessel","","IR;IRAN;ISRAEL;NAVAL;OP-EPIC-FURY;STRAIT-OF-HORMUZ;US","enriched","FALSE","FALSE","FALSE","FALSE"
"tw-20260228114003-iran-unk","Independent Actions","Trump says he can 'go long and take over the whole thing' with regards to current…","Feb 28, 2026","strike","strike","FALSE","","","","","32.0","53.0","Iran","","Trump says he can 'go long and take over the whole thing' with regards to current operation in Iran, or 'end it in two or three days', according to Axios report.","Naval facility","","","IR;IRAN;STRIKE","enriched","FALSE","FALSE","FALSE","FALSE"
"tw-20260228123001-iran-12dayw","12-Day War (IDF)","Israeli military says it killed several top Iranian security officials including…","Feb 28, 2026","strike","strike","FALSE","31.9","34.8","Israel (IAF)","Israeli Air Force bases","32.0","53.0","Iran","","Israeli military says it killed several top Iranian security officials including defense minister, most senior adviser to the president, the intelligence chief and head of military bureau.","Air defense / TEL","","","12-DAY-WAR-(IDF);IR;IRAN;STRIKE","enriched","FALSE","FALSE","FALSE","FALSE"
"tw-20260228124003-iran-iranre","Iran Retaliation","New missile launches from Iran","Feb 28, 2026","strike","missile","FALSE","32.0","53.0","Iran / Proxy Forces","IRGC launch sites","32.0","53.0","Iran","","New missile launches from Iran","Area / Infrastructure","Ballistic / Cruise Missile","","IR;IRAN;IRAN-RETALIATION;MISSILE","enriched","FALSE","FALSE","FALSE","FALSE"
"tw-20260228124003-iran-unk","Independent Actions","UAE air defenses intercept Iranian missiles","Feb 28, 2026","strike","missile","FALSE","","","","","32.0","53.0","Iran","","UAE air defenses intercept Iranian missiles","Air defense / TEL","Ballistic / Cruise Missile","","IR;IRAN;MISSILE","enriched","FALSE","FALSE","FALSE","FALSE"
"tw-20260228125001-tel-aviv-unk","Independent Actions","Ballistic missile impact in Tel Aviv","Feb 28, 2026","strike","missile","FALSE","","","","","32.08","34.78","Tel Aviv","","Ballistic missile impact in Tel Aviv","Air defense / TEL","Ballistic / Cruise Missile","","IL;MISSILE;TEL-AVIV","enriched","FALSE","FALSE","FALSE","FALSE"
"tw-20260228130004-doha-unk","Independent Actions","Over a dozen blasts heard over Doha","Feb 28, 2026","strike","strike","FALSE","","","","","25.28","51.53","Doha","","Over a dozen blasts heard over Doha, according to Al-Jazeera.","Military target","","","DOHA;QA;STRIKE","enriched","FALSE","FALSE","FALSE","FALSE"
"tw-20260228133002-iran-unk","Independent Actions","Iranian attack strikes Dubai airport","Feb 28, 2026","strike","strike","FALSE","","","","","32.0","53.0","Iran","","Iranian attack strikes Dubai airport","Naval facility","","","IR;IRAN;STRIKE","enriched","FALSE","FALSE","FALSE","FALSE"
"tw-20260228135003-iran-opepic","Op. Epic Fury","MIDDLE EAST - Iran's Supreme Leader has been killed - Strikes decapitated much of…","Feb 28, 2026","strike","naval","FALSE","-7.32","72.42","Diego Garcia BIOT","US/UK forward base","32.0","53.0","Iran","","MIDDLE EAST - Iran's Supreme Leader has been killed - Strikes decapitated much of Iran's political, military and security leadership - Israel and US call on Iranians to change government - Iranian mis","Naval vessel","Naval Vessel","","IR;IRAN;ISRAEL;NAVAL;OP-EPIC-FURY;US","enriched","FALSE","FALSE","FALSE","FALSE"
"tw-20260228140004-beijing-unk","Independent Actions","China's ambassador to the UN says Beijing is 'deeply shocked' by attacks on Iran","Feb 28, 2026","strike","strike","FALSE","","","","","39.91","116.39","Beijing","","China's ambassador to the UN says Beijing is 'deeply shocked' by attacks on Iran","Military target","","","BEIJING;CHINA;CN;IRAN;STRIKE","enriched","FALSE","FALSE","FALSE","FALSE"
"tw-20260228140004-iran-unk","Independent Actions","Reports of Iranian drone attack on iconic Burj al-Arab hotel in Dubai","Feb 28, 2026","strike","drone","FALSE","","","","","32.0","53.0","Iran","","Reports of Iranian drone attack on iconic Burj al-Arab hotel in Dubai","Naval facility","UAV / Drone","","DRONE;IR;IRAN","enriched","FALSE","FALSE","FALSE","TRUE"
"tw-20260228144002-iran-unk","Independent Actions","UAE says it destroyed 132 Iranian missiles and repelled 195 Iranian drone attacks","Feb 28, 2026","strike","missile","FALSE","","","","","32.0","53.0","Iran","","UAE says it destroyed 132 Iranian missiles and repelled 195 Iranian drone attacks","Drone / UAV","UAV / Drone","","IR;IRAN;MISSILE","enriched","FALSE","FALSE","FALSE","FALSE"
"tw-20260228154002-israel-iranre","Iran Retaliation","Iran launches ballistic missiles towards Israel","Feb 28, 2026","strike","missile","FALSE","32.0","53.0","Iran / Proxy Forces","IRGC launch sites","31.5","34.9","Israel","","Iran launches ballistic missiles towards Israel","Area / Infrastructure","Ballistic / Cruise Missile","","IL;IRAN;IRAN-RETALIATION;ISRAEL;MISSILE","enriched","FALSE","FALSE","FALSE","FALSE"
"tw-20260228160002-iran-unk","Independent Actions","Qatar intercepts new wave of Iranian missiles","Feb 28, 2026","strike","missile","FALSE","","","","","32.0","53.0","Iran","","Qatar intercepts new wave of Iranian missiles","Area / Infrastructure","Ballistic / Cruise Missile","","IR;IRAN;MISSILE","enriched","FALSE","FALSE","FALSE","FALSE"
"tw-20260228164002-tehran-unk","Independent Actions","New blasts heard in Tehran","Feb 28, 2026","strike","strike","FALSE","","","","","35.69","51.39","Tehran","","New blasts heard in Tehran","Military target","","","IR;STRIKE;TEHRAN","enriched","FALSE","FALSE","FALSE","FALSE"
"tw-20260228164002-israel-opepic","Op. Epic Fury","Israeli military is conducting new wave of strikes on Iran","Feb 28, 2026","strike","strike","FALSE","-7.32","72.42","Diego Garcia BIOT","US/UK forward base","31.5","34.9","Israel","","Israeli military is conducting new wave of strikes on Iran","Military target","","","IL;IRAN;ISRAEL;OP-EPIC-FURY;STRIKE","enriched","FALSE","FALSE","FALSE","FALSE"
"tw-20260228180002-iran-iranre","Iran Retaliation","Iranian Revolutionary Guards vow retaliation over killing of Iran's Supreme…","Feb 28, 2026","strike","strike","FALSE","32.0","53.0","Iran / Proxy Forces","IRGC launch sites","32.0","53.0","Iran","","Iranian Revolutionary Guards vow retaliation over killing of Iran's Supreme Leader Khamenei","Military target","","","IR;IRAN;IRAN-RETALIATION;STRIKE","enriched","TRUE","FALSE","FALSE","FALSE"
