"incident_id","operation_name","incident_title","date","incident_type","strike_type","confirmed","origin_lat","origin_lng","origin_label","origin_sublabel","target_lat","target_lng","target_label","target_sublabel","summary","target_type","platform_or_unit","result_outcome","tags","source_type","is_retaliation","is_covert","is_first_use","disputed"
"tw-20250502144003-israel-unk","Independent Actions","Israeli air force has conducted over 20 strikes across Syrian territory","May 2, 2025","strike","fighter","FALSE","","","","","31.5","34.9","Israel","","Israeli air force has conducted over 20 strikes across Syrian territory","Military target","Multi-role Fighter Aircraft","","FIGHTER;IL;ISRAEL","enriched","FALSE","FALSE","FALSE","FALSE"
"tw-20250504165004-israel-houthi","Houthi / Proxies","Israeli Defense Minister Israel Katz says his country's response to Houthi…","May 4, 2025","strike","missile","FALSE","15.37","44.19","Yemen (Houthi)","Sana'a / Hodeidah","31.5","34.9","Israel","","Israeli Defense Minister Israel Katz says his country's response to Houthi missile attack will be 'sevenfold'","Area / Infrastructure","Ballistic / Cruise Missile","","HOUTHI;HOUTHI-/-PROXIES;IL;ISRAEL;MISSILE","enriched","FALSE","FALSE","FALSE","FALSE"
"tw-20250506132004-pakistan-unk","Independent Actions","Pakistan military spokesman says there have been three missile strikes from India…","May 6, 2025","strike","missile","FALSE","","","","","30.0","69.0","Pakistan","","Pakistan military spokesman says there have been three missile strikes from India on targets inside Pakistani territory","Area / Infrastructure","Ballistic / Cruise Missile","","MISSILE;PAKISTAN;PK","enriched","FALSE","FALSE","FALSE","FALSE"
"tw-20250506133003-pakistan-unk","Independent Actions","Flights diverted as India's military launches strikes against targets inside Pakistan","May 6, 2025","strike","strike","FALSE","","","","","30.0","69.0","Pakistan","","Flights diverted as India's military launches strikes against targets inside Pakistan","Military target","","","PAKISTAN;PK;STRIKE","enriched","FALSE","FALSE","FALSE","FALSE"
"tw-20250506133003-pakistan-unk-1","Independent Actions","India's military says it has conducted precision strikes at terrorist camps…","May 6, 2025","strike","fighter","FALSE","","","","","30.0","69.0","Pakistan","","India's military says it has conducted precision strikes at terrorist camps inside Pakistani territory","Military target","Multi-role Fighter Aircraft","","FIGHTER;PAKISTAN;PK","enriched","FALSE","FALSE","FALSE","FALSE"
"tw-20250506133004-pakistan-unk","Independent Actions","India's military confirms it has launched strikes against targets in Pakistani…","May 6, 2025","strike","strike","FALSE","","","","","30.0","69.0","Pakistan","","India's military confirms it has launched strikes against targets in Pakistani territory","Military target","","","PAKISTAN;PK;STRIKE","enriched","FALSE","FALSE","FALSE","FALSE"
"tw-20250506135005-pakistan-unk","Independent Actions","India says it has targeted nine sites inside Pakistani territory as part of…","May 6, 2025","strike","strike","FALSE","","","","","30.0","69.0","Pakistan","","India says it has targeted nine sites inside Pakistani territory as part of 'Operation Sindoor'","Military target","","","PAKISTAN;PK;STRIKE","enriched","FALSE","FALSE","FALSE","FALSE"
"tw-20250506142003-pakistan-unk","Independent Actions","Pakistan says all targets hit by India's military are civilian sites","May 6, 2025","strike","strike","FALSE","","","","","30.0","69.0","Pakistan","","Pakistan says all targets hit by India's military are civilian sites, not militant camps.","Military target","","","PAKISTAN;PK;STRIKE","enriched","FALSE","FALSE","FALSE","FALSE"
"tw-20250506142004-pakistan-unk","Independent Actions","Pakistani media reports that the military is initiating retaliatory attacks…","May 6, 2025","strike","strike","FALSE","","","","","30.0","69.0","Pakistan","","Pakistani media reports that the military is initiating retaliatory attacks against India","Naval facility","","","PAKISTAN;PK;STRIKE","enriched","TRUE","FALSE","FALSE","FALSE"
"tw-20250506142004-pakistan-unk-1","Independent Actions","Pakistani military says that India will receive a 'comprehensive and decisive…","May 6, 2025","strike","strike","FALSE","","","","","30.0","69.0","Pakistan","","Pakistani military says that India will receive a 'comprehensive and decisive response'","Military target","","","PAKISTAN;PK;STRIKE","enriched","FALSE","FALSE","FALSE","FALSE"
"tw-20250506142004-pakistan-unk-2","Independent Actions","Pakistan's defense minister says India launched missiles from its own territory","May 6, 2025","strike","missile","FALSE","","","","","30.0","69.0","Pakistan","","Pakistan's defense minister says India launched missiles from its own territory, did not enter Pakistani airspace.","Area / Infrastructure","Ballistic / Cruise Missile","","MISSILE;PAKISTAN;PK","enriched","FALSE","FALSE","FALSE","FALSE"
"tw-20250506142009-pakistan-unk","Independent Actions","Nuclear warheads 🇮🇳 India: 172 🇵🇰 Pakistan: 170 (SIPRI)","May 6, 2025","strike","nuclear","FALSE","","","","","30.0","69.0","Pakistan","","Nuclear warheads 🇮🇳 India: 172 🇵🇰 Pakistan: 170 (SIPRI)","Nuclear facility","Strike Aircraft / Cruise Missile","","NUCLEAR;PAKISTAN;PK","enriched","FALSE","FALSE","FALSE","FALSE"
"tw-20250506144004-pakistan-unk","Independent Actions","Pakistan's PM says the military will be responding to Indian strikes","May 6, 2025","strike","strike","FALSE","","","","","30.0","69.0","Pakistan","","Pakistan's PM says the military will be responding to Indian strikes","Military target","","","PAKISTAN;PK;STRIKE","enriched","FALSE","FALSE","FALSE","FALSE"
"tw-20250506151002-pakistan-unk","Independent Actions","India says it has killed 12 terrorists in strikes in Pakistan","May 6, 2025","strike","strike","FALSE","","","","","30.0","69.0","Pakistan","","India says it has killed 12 terrorists in strikes in Pakistan","Military target","","","PAKISTAN;PK;STRIKE","enriched","FALSE","FALSE","FALSE","FALSE"
"tw-20250506151003-pakistan-unk","Independent Actions","Pakistani officials and media claim that two Indian military jets have been downed","May 6, 2025","economic","fighter","FALSE","","","","","30.0","69.0","Pakistan","","Pakistani officials and media claim that two Indian military jets have been downed, although this has not been independently verified.","Military target","Multi-role Fighter Aircraft","","FIGHTER;PAKISTAN;PK","enriched","FALSE","FALSE","FALSE","FALSE"
"tw-20250506153003-russia-unk","Independent Actions","Indian officials have spoken to counterparts in the US","May 6, 2025","strike","strike","FALSE","","","","","61.52","105.32","Russia","","Indian officials have spoken to counterparts in the US, UK, Saudi Arabia, UAE and Russia to brief them on the steps taken by their military.","Military target","","","RU;RUSSIA;STRIKE","enriched","FALSE","FALSE","FALSE","FALSE"
"tw-20250506162004-pakistan-unk","Independent Actions","Pakistan's defense minister claims that five Indian planes have been shot down…","May 6, 2025","economic","strike","FALSE","","","","","30.0","69.0","Pakistan","","Pakistan's defense minister claims that five Indian planes have been shot down and that several Indian soldiers have been taken prisoner","Military target","","","PAKISTAN;PK;STRIKE","enriched","FALSE","FALSE","FALSE","FALSE"
"tw-20250506171002-pakistan-unk","Independent Actions","Pakistani military says none of its aircraft have been shot down","May 6, 2025","economic","fighter","FALSE","","","","","30.0","69.0","Pakistan","","Pakistani military says none of its aircraft have been shot down","Military target","Multi-role Fighter Aircraft","","FIGHTER;PAKISTAN;PK","enriched","FALSE","FALSE","FALSE","FALSE"
"tw-20250506171003-pakistan-unk","Independent Actions","Pakistani military says Indian jets were shot down while they were in Indian airspace","May 6, 2025","economic","fighter","FALSE","","","","","30.0","69.0","Pakistan","","Pakistani military says Indian jets were shot down while they were in Indian airspace","Military target","Multi-role Fighter Aircraft","","FIGHTER;PAKISTAN;PK","enriched","FALSE","FALSE","FALSE","FALSE"
"tw-20250506213005-pakistan-unk","Independent Actions","Indian police official says that 10 people were killed in Pakistani shelling on…","May 6, 2025","strike","artillery","FALSE","","","","","30.0","69.0","Pakistan","","Indian police official says that 10 people were killed in Pakistani shelling on Indian Kashmir","Military target","","","ARTILLERY;PAKISTAN;PK","enriched","FALSE","FALSE","FALSE","FALSE"
"tw-20250506213006-pakistan-unk","Independent Actions","Pakistan's defense minister says the military is ready to refrain from further…","May 6, 2025","strike","strike","FALSE","","","","","30.0","69.0","Pakistan","","Pakistan's defense minister says the military is ready to refrain from further action if India halts its operations","Military target","","","PAKISTAN;PK;STRIKE","enriched","FALSE","FALSE","FALSE","FALSE"
"tw-20250507014003-pakistan-unk","Independent Actions","Military armed personnel 🇮🇳 India: 1,400,000 🇵🇰 Pakistan: 660,000","May 7, 2025","strike","strike","FALSE","","","","","30.0","69.0","Pakistan","","Military armed personnel 🇮🇳 India: 1,400,000 🇵🇰 Pakistan: 660,000","Military target","","","PAKISTAN;PK;STRIKE","enriched","FALSE","FALSE","FALSE","FALSE"
"tw-20250507021001-pakistan-unk","Independent Actions","Pakistani Prime Minister Shehbaz Sharif's office has announce the military has…","May 7, 2025","strike","strike","FALSE","","","","","30.0","69.0","Pakistan","","Pakistani Prime Minister Shehbaz Sharif's office has announce the military has been formally authorized to respond to India's strikes","Military target","","","PAKISTAN;PK;STRIKE","enriched","FALSE","FALSE","FALSE","FALSE"
"tw-20250507141003-pakistan-unk","Independent Actions","CNN reports that a high-ranking French intelligence officer says that 'one Rafale…","May 7, 2025","economic","fighter","FALSE","","","","","30.0","69.0","Pakistan","","CNN reports that a high-ranking French intelligence officer says that 'one Rafale fighter jet operated by the Indian Air Force was downed by Pakistan', making it the first loss of the aircraft in comb","Naval facility","Multi-role Fighter Aircraft","","FIGHTER;PAKISTAN;PK","enriched","FALSE","FALSE","FALSE","FALSE"
"tw-20250507195002-pakistan-unk","Independent Actions","Reports of blast heard in Lahore","May 7, 2025","strike","strike","FALSE","","","","","30.0","69.0","Pakistan","","Reports of blast heard in Lahore, Pakistan, with cause not yet known.","Naval facility","","","PAKISTAN;PK;STRIKE","enriched","FALSE","FALSE","FALSE","TRUE"
"tw-20250508022003-pakistan-unk","Independent Actions","Pakistan says its military has shot down drones sent by India","May 8, 2025","economic","drone","FALSE","","","","","30.0","69.0","Pakistan","","Pakistan says its military has shot down drones sent by India","Drone / UAV","UAV / Drone","","DRONE;PAKISTAN;PK","enriched","FALSE","FALSE","FALSE","FALSE"
"tw-20250509115005-pakistan-unk","Independent Actions","The Telegraph reports that India has 'sent warships with supersonic cruise…","May 9, 2025","strike","naval","FALSE","","","","","30.0","69.0","Pakistan","","The Telegraph reports that India has 'sent warships with supersonic cruise missiles towards Pakistan'","Naval facility","Naval Vessel","","NAVAL;PAKISTAN;PK","enriched","FALSE","FALSE","FALSE","FALSE"
"tw-20250509135001-pakistan-unk","Independent Actions","Reports of loud blasts near Lahore","May 9, 2025","strike","strike","FALSE","","","","","30.0","69.0","Pakistan","","Reports of loud blasts near Lahore, Pakistan.","Naval facility","","","PAKISTAN;PK;STRIKE","enriched","FALSE","FALSE","FALSE","TRUE"
"tw-20250509142003-pakistan-unk","Independent Actions","Pakistan claims that India's military launched six ballistic missiles that landed…","May 9, 2025","strike","missile","FALSE","","","","","30.0","69.0","Pakistan","","Pakistan claims that India's military launched six ballistic missiles that landed within Indian territory","Area / Infrastructure","Ballistic / Cruise Missile","","MISSILE;PAKISTAN;PK","enriched","FALSE","FALSE","FALSE","FALSE"
"tw-20250509143004-pakistan-unk","Independent Actions","Blasts heard in Rawalpindi","May 9, 2025","strike","strike","FALSE","","","","","30.0","69.0","Pakistan","","Blasts heard in Rawalpindi, Pakistan.","Military target","","","PAKISTAN;PK;STRIKE","enriched","FALSE","FALSE","FALSE","FALSE"
"tw-20250509145003-pakistan-unk","Independent Actions","Reports that an Indian strike has targeted a Pakistani military base in Rawalpindi","May 9, 2025","strike","strike","FALSE","","","","","30.0","69.0","Pakistan","","Reports that an Indian strike has targeted a Pakistani military base in Rawalpindi","Military base / C2","","","PAKISTAN;PK;STRIKE","enriched","FALSE","FALSE","FALSE","FALSE"
"tw-20250509153005-pakistan-unk","Independent Actions","Reports that India's military has targeted three Pakistani air bases","May 9, 2025","strike","strike","FALSE","","","","","30.0","69.0","Pakistan","","Reports that India's military has targeted three Pakistani air bases","Military base / C2","","","PAKISTAN;PK;STRIKE","enriched","FALSE","FALSE","FALSE","FALSE"
"tw-20250509165004-pakistan-unk","Independent Actions","Pakistan media reports the military has initiated retaliatory action against India","May 9, 2025","strike","strike","FALSE","","","","","30.0","69.0","Pakistan","","Pakistan media reports the military has initiated retaliatory action against India","Naval facility","","","PAKISTAN;PK;STRIKE","enriched","TRUE","FALSE","FALSE","FALSE"
"tw-20250509171002-pakistan-unk","Independent Actions","Pakistani military targets sites in Indian cities of Amritsar and Jammu","May 9, 2025","strike","strike","FALSE","","","","","30.0","69.0","Pakistan","","Pakistani military targets sites in Indian cities of Amritsar and Jammu","Military target","","","PAKISTAN;PK;STRIKE","enriched","FALSE","FALSE","FALSE","FALSE"
"tw-20250509174003-pakistan-unk","Independent Actions","Pakistani military has targeted several Indian military bases","May 9, 2025","strike","strike","FALSE","","","","","30.0","69.0","Pakistan","","Pakistani military has targeted several Indian military bases","Military base / C2","","","PAKISTAN;PK;STRIKE","enriched","FALSE","FALSE","FALSE","FALSE"
"tw-20250509190004-pakistan-unk","Independent Actions","The New York Times reports Indian officials saying that Pakistan's military…","May 9, 2025","strike","drone","FALSE","","","","","30.0","69.0","Pakistan","","The New York Times reports Indian officials saying that Pakistan's military attempted aerial intrusions in '36 locations with 300 to 400 drones'","Naval facility","UAV / Drone","","DRONE;PAKISTAN;PK","enriched","FALSE","FALSE","FALSE","FALSE"
"tw-20250509192003-pakistan-unk","Independent Actions","Pakistan claims its military has destroyed an Indian S-400 air defense system","May 9, 2025","strike","missile","FALSE","","","","","30.0","69.0","Pakistan","","Pakistan claims its military has destroyed an Indian S-400 air defense system","Air defense / TEL","Ballistic / Cruise Missile","","MISSILE;PAKISTAN;PK;S-400","enriched","FALSE","FALSE","FALSE","FALSE"
"tw-20250509203004-pakistan-unk","Independent Actions","US Secretary of State Rubio has called Pakistan's military chief urging de-escalation","May 9, 2025","strike","strike","FALSE","","","","","30.0","69.0","Pakistan","","US Secretary of State Rubio has called Pakistan's military chief urging de-escalation","Military target","","","PAKISTAN;PK;STRIKE;US","enriched","FALSE","FALSE","FALSE","FALSE"
"tw-20250509224003-pakistan-unk","Independent Actions","Pakistan is deploying additional military assets to the border","May 9, 2025","strike","strike","FALSE","","","","","30.0","69.0","Pakistan","","Pakistan is deploying additional military assets to the border","Military target","","","PAKISTAN;PK;STRIKE","enriched","FALSE","FALSE","FALSE","FALSE"
"tw-20250511230003-ukraine-russia","Russia-Ukraine War","Ukraine's air force says that Russia launched 108 drones overnight","May 11, 2025","strike","drone","FALSE","50.45","30.52","Ukraine (UAF)","Ukrainian Armed Forces","48.38","31.17","Ukraine","","Ukraine's air force says that Russia launched 108 drones overnight","Drone / UAV","UAV / Drone","","DRONE;RUSSIA;RUSSIA-UKRAINE-WAR;UA;UKRAINE","enriched","FALSE","FALSE","FALSE","FALSE"
"tw-20250518040003-israel-opswor","Op. Swords of Iron","Israeli defense minister says Hamas chief in Gaza","May 18, 2025","strike","strike","FALSE","31.9","34.8","Israel (IAF)","Israeli Air Force bases","31.5","34.9","Israel","","Israeli defense minister says Hamas chief in Gaza, Muhammad Sinwar, who succeeded his brother, has likely been killed.","Military target","","","HAMAS;IL;ISRAEL;OP-SWORDS-OF-IRON;STRIKE","enriched","FALSE","FALSE","FALSE","FALSE"
"tw-20250518221008-israel-opswor","Op. Swords of Iron","Reports of Israeli military operation in southern Gaza and internet disruptions…","May 18, 2025","strike","strike","FALSE","31.9","34.8","Israel (IAF)","Israeli Air Force bases","31.5","34.9","Israel","","Reports of Israeli military operation in southern Gaza and internet disruptions in the area","Naval facility","","","IL;ISRAEL;OP-SWORDS-OF-IRON;STRIKE","enriched","FALSE","FALSE","FALSE","TRUE"
"tw-20250519021003-netanya-opswor","Op. Swords of Iron","Netanyahu says the military will take control of all of Gaza","May 19, 2025","strike","strike","FALSE","31.9","34.8","Israel (IAF)","Israeli Air Force bases","32.33","34.86","Netanya","","Netanyahu says the military will take control of all of Gaza","Military target","","","IL;NETANYA;OP-SWORDS-OF-IRON;STRIKE","enriched","FALSE","FALSE","FALSE","FALSE"
"tw-20250519133002-israel-unk","Independent Actions","Leaders of UK, Canada and France threaten 'concrete actions' if 'Israel does not…","May 19, 2025","strike","strike","FALSE","","","","","31.5","34.9","Israel","","Leaders of UK, Canada and France threaten 'concrete actions' if 'Israel does not cease the renewed military offensive and lift its restrictions on humanitarian aid'","Military target","","","IL;ISRAEL;STRIKE","enriched","FALSE","FALSE","FALSE","FALSE"
"tw-20250520153003-iran-12dayw","12-Day War (IDF)","CNN reports that Israel is making preparations to strike Iranian nuclear facilities","May 20, 2025","strike","nuclear","FALSE","31.9","34.8","Israel (IAF)","Israeli Air Force bases","32.0","53.0","Iran","","CNN reports that Israel is making preparations to strike Iranian nuclear facilities","Nuclear facility","Strike Aircraft / Cruise Missile","","12-DAY-WAR-(IDF);IR;IRAN;ISRAEL;NUCLEAR","enriched","FALSE","FALSE","FALSE","FALSE"
"tw-20250521143003-iran-12dayw","12-Day War (IDF)","Axios reports that Israel is making preparations to 'swiftly' strike Iranian…","May 21, 2025","strike","nuclear","FALSE","31.9","34.8","Israel (IAF)","Israeli Air Force bases","32.0","53.0","Iran","","Axios reports that Israel is making preparations to 'swiftly' strike Iranian nuclear facilities if talks between the US and Iran collapse","Nuclear facility","Strike Aircraft / Cruise Missile","","12-DAY-WAR-(IDF);IR;IRAN;ISRAEL;NUCLEAR;US","enriched","FALSE","FALSE","FALSE","FALSE"
"tw-20250601040001-russia-unk","Independent Actions","Reports of several blasts near Russian air base","Jun 1, 2025","strike","strike","FALSE","","","","","61.52","105.32","Russia","","Reports of several blasts near Russian air base","Military base / C2","","","RU;RUSSIA;STRIKE","enriched","FALSE","FALSE","FALSE","TRUE"
"tw-20250601042003-ukraine-russia","Russia-Ukraine War","Reports that several Russian strategic bombers are on fire after large Ukrainian…","Jun 1, 2025","strike","drone","FALSE","50.45","30.52","Ukraine (UAF)","Ukrainian Armed Forces","48.38","31.17","Ukraine","","Reports that several Russian strategic bombers are on fire after large Ukrainian drone attack","Naval facility","UAV / Drone","","DRONE;RUSSIA-UKRAINE-WAR;UA;UKRAINE","enriched","FALSE","FALSE","FALSE","FALSE"
"tw-20250601053002-ukraine-russia","Russia-Ukraine War","Four Russian airfields housing strategic bombers have been attacked by Ukrainian…","Jun 1, 2025","strike","fighter","FALSE","50.45","30.52","Ukraine (UAF)","Ukrainian Armed Forces","48.38","31.17","Ukraine","","Four Russian airfields housing strategic bombers have been attacked by Ukrainian military so far","Airport / Airfield","Multi-role Fighter Aircraft","","FIGHTER;RUSSIA-UKRAINE-WAR;UA;UKRAINE","enriched","FALSE","FALSE","FALSE","FALSE"
"tw-20250605025002-pakistan-unk","Independent Actions","Indonesia says that China has offered to sell it J-10 fighter jets","Jun 5, 2025","strike","fighter","FALSE","","","","","30.0","69.0","Pakistan","","Indonesia says that China has offered to sell it J-10 fighter jets, the aircraft that was recently used by Pakistan.","Military target","Multi-role Fighter Aircraft","","CHINA;FIGHTER;PAKISTAN;PK","enriched","FALSE","FALSE","FALSE","FALSE"
"tw-20250605130004-lebanon-opnort","Op. Northern Arrows","Israel's military conducts strikes on Hezbollah targets in Lebanon","Jun 5, 2025","strike","strike","FALSE","31.9","34.8","Israel (IAF)","Israeli Air Force bases","33.9","35.5","Lebanon","","Israel's military conducts strikes on Hezbollah targets in Lebanon","Military target","","","HEZBOLLAH;ISRAEL;LB;LEBANON;OP-NORTHERN-ARROWS;STRIKE","enriched","FALSE","FALSE","FALSE","FALSE"
"tw-20250605134004-israel-12dayw","12-Day War (IDF)","Axios reports Israel has assured the White House that there will not be a strike…","Jun 5, 2025","strike","nuclear","FALSE","31.9","34.8","Israel (IAF)","Israeli Air Force bases","31.5","34.9","Israel","","Axios reports Israel has assured the White House that there will not be a strike on Iran's nuclear facilities unless Trump signals talks have failed","Nuclear facility","Strike Aircraft / Cruise Missile","","12-DAY-WAR-(IDF);IL;IRAN;ISRAEL;NUCLEAR","enriched","FALSE","FALSE","FALSE","FALSE"
"tw-20250608172004-russia-russia","Russia-Ukraine War","Russia launches ballistic missiles towards Kyiv","Jun 8, 2025","strike","missile","FALSE","55.75","37.62","Russia (MoD)","Russian Armed Forces","61.52","105.32","Russia","","Russia launches ballistic missiles towards Kyiv","Area / Infrastructure","Ballistic / Cruise Missile","","MISSILE;RU;RUSSIA;RUSSIA-UKRAINE-WAR","enriched","FALSE","FALSE","FALSE","FALSE"
"tw-20250609020003-ukraine-russia","Russia-Ukraine War","Ukraine says that Russia launched 479 drones last night","Jun 9, 2025","strike","drone","FALSE","50.45","30.52","Ukraine (UAF)","Ukrainian Armed Forces","48.38","31.17","Ukraine","","Ukraine says that Russia launched 479 drones last night, marking the biggest drone attack of the war so far.","Drone / UAV","UAV / Drone","","DRONE;RUSSIA;RUSSIA-UKRAINE-WAR;UA;UKRAINE","enriched","FALSE","FALSE","FALSE","FALSE"
"tw-20250609220005-israel-unk","Independent Actions","Israel is conducting strikes in Yemen","Jun 9, 2025","strike","strike","FALSE","","","","","31.5","34.9","Israel","","Israel is conducting strikes in Yemen","Military target","","","IL;ISRAEL;STRIKE","enriched","FALSE","FALSE","FALSE","FALSE"
"tw-20250611150003-iran-unk","Independent Actions","The US has ordered all embassies within strike range of Iran to convene emergency…","Jun 11, 2025","strike","strike","FALSE","","","","","32.0","53.0","Iran","","The US has ordered all embassies within strike range of Iran to convene emergency action meetings and decide measures they are taking to mitigate risks","Military target","","","IR;IRAN;STRIKE;US","enriched","FALSE","FALSE","FALSE","FALSE"
"tw-20250611150003-iran-unk-1","Independent Actions","US Senator Tom Cotton says that the Pentagon believes Iran is 'actively working…","Jun 11, 2025","strike","nuclear","FALSE","","","","","32.0","53.0","Iran","","US Senator Tom Cotton says that the Pentagon believes Iran is 'actively working towards a nuclear weapon'","Nuclear facility","Strike Aircraft / Cruise Missile","","IR;IRAN;NUCLEAR;US","enriched","FALSE","FALSE","FALSE","FALSE"
"tw-20250611152004-israel-12dayw","12-Day War (IDF)","The Washington Post reports that US intelligence officials have grown…","Jun 11, 2025","strike","nuclear","FALSE","31.9","34.8","Israel (IAF)","Israeli Air Force bases","31.5","34.9","Israel","","The Washington Post reports that US intelligence officials have grown 'increasingly concerned that Israel may choose to strike Iran’s nuclear facilities without the consent of the United States'","Nuclear facility","Strike Aircraft / Cruise Missile","","12-DAY-WAR-(IDF);IL;ISRAEL;NUCLEAR;US","enriched","FALSE","FALSE","FALSE","FALSE"
"tw-20250611160005-iran-unk","Independent Actions","Trump says US personnel in the Middle East are being moved out because 'it could…","Jun 11, 2025","strike","nuclear","FALSE","","","","","32.0","53.0","Iran","","Trump says US personnel in the Middle East are being moved out because 'it could be a dangerous place, we will see what happens. Iran cannot have a nuclear weapon, we won't allow it'.","Nuclear facility","Strike Aircraft / Cruise Missile","","IR;IRAN;NUCLEAR;US","enriched","FALSE","FALSE","FALSE","FALSE"
"tw-20250611174002-israel-12dayw","12-Day War (IDF)","CBS reports that Israel has informed US officials it is fully ready to launch an…","Jun 11, 2025","strike","strike","FALSE","31.9","34.8","Israel (IAF)","Israeli Air Force bases","31.5","34.9","Israel","","CBS reports that Israel has informed US officials it is fully ready to launch an operation against Iran","Naval facility","","","12-DAY-WAR-(IDF);IL;IRAN;ISRAEL;STRIKE;US","enriched","FALSE","FALSE","FALSE","FALSE"
