"incident_id","operation_name","incident_title","date","incident_type","strike_type","confirmed","origin_lat","origin_lng","origin_label","origin_sublabel","target_lat","target_lng","target_label","target_sublabel","summary","target_type","platform_or_unit","result_outcome","tags","source_type","is_retaliation","is_covert","is_first_use","disputed"
"tw-20250621182002-iran-unk","Independent Actions","Iranian state television says","Jun 21, 2025","strike","strike","FALSE","","","","","32.0","53.0","Iran","","Iranian state television says, 'every American citizen or military personnel in the region is now a target'.","Air defense / TEL","","","IR;IRAN;STRIKE","enriched","FALSE","FALSE","FALSE","FALSE"
"tw-20250621182002-iran-unk-1","Independent Actions","Trump and Netanyahu have spoken after bombing of Iranian nuclear facilities","Jun 21, 2025","strike","nuclear","FALSE","","","","","32.0","53.0","Iran","","Trump and Netanyahu have spoken after bombing of Iranian nuclear facilities","Nuclear facility","Strike Aircraft / Cruise Missile","","IR;IRAN;NUCLEAR","enriched","FALSE","FALSE","FALSE","FALSE"
"tw-20250621182003-fordow-opmidn","Op. Midnight Hammer","GBU-57A/B MOP - 30,000-pound (13,600 kg)-'bunker buster' bomb developed for the…","Jun 21, 2025","strike","nuclear","FALSE","-7.32","72.42","Diego Garcia BIOT","US/UK forward base","34.88","50.49","Fordow","","GBU-57A/B MOP - 30,000-pound (13,600 kg)-'bunker buster' bomb developed for the United States Air Force - Can penetrate about 60 m (200 ft) of earth or 18 m (59 ft) of concrete - Can be dropped only b","Military target","Strike Aircraft / Cruise Missile","","B-2;FORDOW;IR;NUCLEAR;OP-MIDNIGHT-HAMMER;US","enriched","FALSE","FALSE","FALSE","FALSE"
"tw-20250621184002-iran-12dayw","12-Day War (IDF)","Israeli media says estimates are that US strikes caused significant damage to…","Jun 21, 2025","strike","nuclear","FALSE","31.9","34.8","Israel (IAF)","Israeli Air Force bases","32.0","53.0","Iran","","Israeli media says estimates are that US strikes caused significant damage to Iranian nuclear facilities","Nuclear facility","Strike Aircraft / Cruise Missile","","12-DAY-WAR-(IDF);IR;IRAN;NUCLEAR;US","enriched","FALSE","FALSE","FALSE","FALSE"
"tw-20250621185005-iran-opmidn","Op. Midnight Hammer","Iranian state television says entry and exit points of Fordow nuclear facility…","Jun 21, 2025","economic","nuclear","FALSE","-7.32","72.42","Diego Garcia BIOT","US/UK forward base","32.0","53.0","Iran","","Iranian state television says entry and exit points of Fordow nuclear facility have been damaged in the US airstrikes","Nuclear facility","Strike Aircraft / Cruise Missile","","IR;IRAN;NUCLEAR;OP-MIDNIGHT-HAMMER;US","enriched","FALSE","FALSE","FALSE","FALSE"
"tw-20250621190003-netanya-unk","Independent Actions","Netanyahu says US strikes will 'change history","Jun 21, 2025","strike","strike","FALSE","","","","","32.33","34.86","Netanya","","Netanyahu says US strikes will 'change history'","Military target","","","IL;NETANYA;STRIKE;US","enriched","FALSE","FALSE","FALSE","FALSE"
"tw-20250621194004-israel-12dayw","12-Day War (IDF)","Israeli media reports the military will halt strikes on Iran for the time being","Jun 21, 2025","strike","strike","FALSE","31.9","34.8","Israel (IAF)","Israeli Air Force bases","31.5","34.9","Israel","","Israeli media reports the military will halt strikes on Iran for the time being","Naval facility","","","12-DAY-WAR-(IDF);IL;IRAN;ISRAEL;STRIKE","enriched","FALSE","FALSE","FALSE","FALSE"
"tw-20250621202004-israel-unk","Independent Actions","ABC News reports the US and Israel practiced today's attack in military exercises…","Jun 21, 2025","strike","strike","FALSE","","","","","31.5","34.9","Israel","","ABC News reports the US and Israel practiced today's attack in military exercises a year ago","Naval facility","","","IL;ISRAEL;STRIKE;US","enriched","FALSE","FALSE","FALSE","FALSE"
"tw-20250621203002-fordow-opmidn","Op. Midnight Hammer","CNN reports the US used six B-2 bombers to drop 12 bunker busters on Fordow…","Jun 21, 2025","economic","nuclear","FALSE","-7.32","72.42","Diego Garcia BIOT","US/UK forward base","34.88","50.49","Fordow","","CNN reports the US used six B-2 bombers to drop 12 bunker busters on Fordow nuclear facility","Nuclear facility","B-2 Spirit","","B-2;FORDOW;IR;NUCLEAR;OP-MIDNIGHT-HAMMER;US","enriched","FALSE","FALSE","FALSE","FALSE"
"tw-20250621203003-saudi-arabia-unk","Independent Actions","Saudi Arabia's nuclear regulator says no radioactive traces have been detected in…","Jun 21, 2025","strike","nuclear","FALSE","","","","","23.89","45.08","Saudi Arabia","","Saudi Arabia's nuclear regulator says no radioactive traces have been detected in the environment of Saudi Arabia or other Gulf states following strikes on Iran's nuclear facilities","Nuclear facility","Strike Aircraft / Cruise Missile","","IRAN;NUCLEAR;SA;SAUDI-ARABIA","enriched","FALSE","FALSE","FALSE","FALSE"
"tw-20250621205002-iran-opmidn","Op. Midnight Hammer","B-2 bombers that struck Iran nuclear sites had flown non-stop for 37 hours…","Jun 21, 2025","strike","nuclear","FALSE","-7.32","72.42","Diego Garcia BIOT","US/UK forward base","32.0","53.0","Iran","","B-2 bombers that struck Iran nuclear sites had flown non-stop for 37 hours straight from their base in Missouri, refuelling several times in mid-air, according to New York Times report.","Nuclear facility","B-2 Spirit","","B-2;IR;IRAN;NUCLEAR;OP-MIDNIGHT-HAMMER","enriched","FALSE","FALSE","FALSE","FALSE"
"tw-20250621212002-israel-12dayw","12-Day War (IDF)","Axios reports Israeli official saying it is too early to determine the exact…","Jun 21, 2025","strike","strike","FALSE","31.9","34.8","Israel (IAF)","Israeli Air Force bases","31.5","34.9","Israel","","Axios reports Israeli official saying it is too early to determine the exact results of US strikes on Iran","Naval facility","","","12-DAY-WAR-(IDF);IL;IRAN;ISRAEL;STRIKE;US","enriched","FALSE","FALSE","FALSE","FALSE"
"tw-20250621213002-iran-unk","Independent Actions","Iran's foreign minister says 'the events this morning are outrageous and will…","Jun 21, 2025","strike","strike","FALSE","","","","","32.0","53.0","Iran","","Iran's foreign minister says 'the events this morning are outrageous and will have everlasting consequences', and calls US strikes 'extremely dangerous, lawless and criminal behavior'.","Military target","","","IR;IRAN;STRIKE;US","enriched","FALSE","FALSE","FALSE","FALSE"
"tw-20250621214001-tel-aviv-unk","Independent Actions","Sirens heard in Tel Aviv amid Iranian ballistic missile attack","Jun 21, 2025","strike","missile","FALSE","","","","","32.08","34.78","Tel Aviv","","Sirens heard in Tel Aviv amid Iranian ballistic missile attack","Air defense / TEL","Ballistic / Cruise Missile","","IL;MISSILE;TEL-AVIV","enriched","FALSE","FALSE","FALSE","FALSE"
"tw-20250621214002-israel-iranre","Iran Retaliation","Iran launches missiles at Israel","Jun 21, 2025","strike","missile","FALSE","32.0","53.0","Iran / Proxy Forces","IRGC launch sites","31.5","34.9","Israel","","Iran launches missiles at Israel","Area / Infrastructure","Ballistic / Cruise Missile","","IL;IRAN;IRAN-RETALIATION;ISRAEL;MISSILE","enriched","FALSE","FALSE","FALSE","FALSE"
"tw-20250621215002-iran-12dayw","12-Day War (IDF)","Israeli media reports about 25 missiles in latest Iranian attack","Jun 21, 2025","strike","missile","FALSE","31.9","34.8","Israel (IAF)","Israeli Air Force bases","32.0","53.0","Iran","","Israeli media reports about 25 missiles in latest Iranian attack","Naval facility","Ballistic / Cruise Missile","","12-DAY-WAR-(IDF);IR;IRAN;MISSILE","enriched","FALSE","FALSE","FALSE","FALSE"
"tw-20250621215002-iran-unk","Independent Actions","Impacts from Iranian ballistic missile attack","Jun 21, 2025","strike","missile","FALSE","","","","","32.0","53.0","Iran","","Impacts from Iranian ballistic missile attack","Area / Infrastructure","Ballistic / Cruise Missile","","IR;IRAN;MISSILE","enriched","FALSE","FALSE","FALSE","FALSE"
"tw-20250621215002-jerusalem-unk","Independent Actions","Blasts heard in Jerusalem","Jun 21, 2025","strike","strike","FALSE","","","","","31.78","35.22","Jerusalem","","Blasts heard in Jerusalem","Military target","","","IL;JERUSALEM;STRIKE","enriched","FALSE","FALSE","FALSE","FALSE"
"tw-20250621215003-tel-aviv-unk","Independent Actions","Blasts heard in Tel Aviv and Haifa","Jun 21, 2025","strike","strike","FALSE","","","","","32.08","34.78","Tel Aviv","","Blasts heard in Tel Aviv and Haifa","Air defense / TEL","","","IL;STRIKE;TEL-AVIV","enriched","FALSE","FALSE","FALSE","FALSE"
"tw-20250621222002-iran-iranre","Iran Retaliation","Iran launches another wave of missiles","Jun 21, 2025","strike","missile","FALSE","32.0","53.0","Iran / Proxy Forces","IRGC launch sites","32.0","53.0","Iran","","Iran launches another wave of missiles","Area / Infrastructure","Ballistic / Cruise Missile","","IR;IRAN;IRAN-RETALIATION;MISSILE","enriched","FALSE","FALSE","FALSE","FALSE"
"tw-20250621231003-israel-12dayw","12-Day War (IDF)","Israeli military says it is now striking targets in Iran","Jun 21, 2025","strike","strike","FALSE","31.9","34.8","Israel (IAF)","Israeli Air Force bases","31.5","34.9","Israel","","Israeli military says it is now striking targets in Iran","Military target","","","12-DAY-WAR-(IDF);IL;IRAN;ISRAEL;STRIKE","enriched","FALSE","FALSE","FALSE","FALSE"
"tw-20250621234004-iran-unk","Independent Actions","Iranian military chief of staff says the people 'will not surrender to any aggression","Jun 21, 2025","strike","strike","FALSE","","","","","32.0","53.0","Iran","","Iranian military chief of staff says the people 'will not surrender to any aggression'","Military target","","","IR;IRAN;STRIKE","enriched","FALSE","FALSE","FALSE","FALSE"
"tw-20250622000002-iran-opepic","Op. Epic Fury","Iraq says US strikes on Iran are a 'grave threat' to regional peace","Jun 22, 2025","strike","strike","FALSE","-7.32","72.42","Diego Garcia BIOT","US/UK forward base","32.0","53.0","Iran","","Iraq says US strikes on Iran are a 'grave threat' to regional peace","Military target","","","IR;IRAN;OP-EPIC-FURY;STRIKE;US","enriched","FALSE","FALSE","FALSE","FALSE"
"tw-20250622004002-iran-opepic","Op. Epic Fury","Oman criticizes US strikes on Iran nuclear facilities","Jun 22, 2025","strike","nuclear","FALSE","-7.32","72.42","Diego Garcia BIOT","US/UK forward base","32.0","53.0","Iran","","Oman criticizes US strikes on Iran nuclear facilities","Nuclear facility","Strike Aircraft / Cruise Missile","","IR;IRAN;NUCLEAR;OP-EPIC-FURY;US","enriched","FALSE","FALSE","FALSE","FALSE"
"tw-20250622040004-israel-12dayw","12-Day War (IDF)","Israeli military says it has 'other goals' in Iran and will continue its strikes…","Jun 22, 2025","strike","strike","FALSE","31.9","34.8","Israel (IAF)","Israeli Air Force bases","31.5","34.9","Israel","","Israeli military says it has 'other goals' in Iran and will continue its strikes 'until we attain them'","Military target","","","12-DAY-WAR-(IDF);IL;IRAN;ISRAEL;STRIKE","enriched","FALSE","FALSE","FALSE","FALSE"
"tw-20250622042003-iran-12dayw","12-Day War (IDF)","Israeli military says it is striking Iranian military sites in central Iran","Jun 22, 2025","strike","strike","FALSE","31.9","34.8","Israel (IAF)","Israeli Air Force bases","32.0","53.0","Iran","","Israeli military says it is striking Iranian military sites in central Iran","Military target","","","12-DAY-WAR-(IDF);IR;IRAN;STRIKE","enriched","FALSE","FALSE","FALSE","FALSE"
"tw-20250622044002-bushehr-unk","Independent Actions","Large blast in city of Bushehr","Jun 22, 2025","strike","strike","FALSE","","","","","28.97","50.84","Bushehr","","Large blast in city of Bushehr, southern Iran.","Military target","","","BUSHEHR;IR;STRIKE","enriched","FALSE","FALSE","FALSE","FALSE"
"tw-20250622052002-iran-unk","Independent Actions","US military chief of staff says all three Iranian nuclear sites sustained severe…","Jun 22, 2025","strike","nuclear","FALSE","","","","","32.0","53.0","Iran","","US military chief of staff says all three Iranian nuclear sites sustained severe damage and destruction.","Nuclear facility","Strike Aircraft / Cruise Missile","","IR;IRAN;NUCLEAR;US","enriched","FALSE","FALSE","FALSE","FALSE"
"tw-20250622053005-iran-opmidn","Op. Midnight Hammer","US military named operation against Iranian nuclear sites 'Midnight Hammer","Jun 22, 2025","strike","nuclear","FALSE","-7.32","72.42","Diego Garcia BIOT","US/UK forward base","32.0","53.0","Iran","","US military named operation against Iranian nuclear sites 'Midnight Hammer'","Nuclear facility","Strike Aircraft / Cruise Missile","","IR;IRAN;NUCLEAR;OP-MIDNIGHT-HAMMER;US","enriched","FALSE","FALSE","FALSE","FALSE"
"tw-20250622122012-fordow-opmidn","Op. Midnight Hammer","Israeli military analysis believes Fordow sustained serious damage but has not…","Jun 22, 2025","economic","nuclear","FALSE","-7.32","72.42","Diego Garcia BIOT","US/UK forward base","34.88","50.49","Fordow","","Israeli military analysis believes Fordow sustained serious damage but has not been completely destroyed, according to New York Times report.","Nuclear facility","Strike Aircraft / Cruise Missile","","FORDOW;IR;NUCLEAR;OP-MIDNIGHT-HAMMER","enriched","FALSE","FALSE","FALSE","FALSE"
"tw-20250622131002-iran-12dayw","12-Day War (IDF)","Axios reports that Israel's air force took out several Iranian air defense…","Jun 22, 2025","strike","nuclear","FALSE","31.9","34.8","Israel (IAF)","Israeli Air Force bases","32.0","53.0","Iran","","Axios reports that Israel's air force took out several Iranian air defense systems at the request of the Trump administration in the lead up to yesterday's strikes on nuclear facilities","Nuclear facility","Strike Aircraft / Cruise Missile","","12-DAY-WAR-(IDF);IR;IRAN;ISRAEL;NUCLEAR","enriched","FALSE","FALSE","FALSE","FALSE"
"tw-20250622134003-russia-unk","Independent Actions","Russia's envoy to the UN says that the United States has 'opened Pandora's box'…","Jun 22, 2025","strike","strike","FALSE","","","","","61.52","105.32","Russia","","Russia's envoy to the UN says that the United States has 'opened Pandora's box' with its strikes on Iran","Military target","","","IRAN;RU;RUSSIA;STRIKE","enriched","FALSE","FALSE","FALSE","FALSE"
"tw-20250622135003-israel-12dayw","12-Day War (IDF)","Israeli military says that 20 fighter jets have conducted intelligence-based…","Jun 22, 2025","strike","fighter","FALSE","31.9","34.8","Israel (IAF)","Israeli Air Force bases","31.5","34.9","Israel","","Israeli military says that 20 fighter jets have conducted intelligence-based strikes on targets inside Iran","Air defense / TEL","Multi-role Fighter Aircraft","","12-DAY-WAR-(IDF);FIGHTER;IL;IRAN;ISRAEL","enriched","FALSE","FALSE","FALSE","FALSE"
"tw-20250622140004-pakistan-12dayw","12-Day War (IDF)","Pakistan's UN envoy says that Israeli attack on Iran was 'foolish' and 'without…","Jun 22, 2025","strike","strike","FALSE","31.9","34.8","Israel (IAF)","Israeli Air Force bases","30.0","69.0","Pakistan","","Pakistan's UN envoy says that Israeli attack on Iran was 'foolish' and 'without provocation'","Military target","","","12-DAY-WAR-(IDF);IRAN;PAKISTAN;PK;STRIKE","enriched","FALSE","FALSE","FALSE","FALSE"
"tw-20250622144004-syria-unk","Independent Actions","The New York Times reports that US officials have 'detected signs that…","Jun 22, 2025","strike","strike","FALSE","","","","","34.8","38.99","Syria","","The New York Times reports that US officials have 'detected signs that Iran-backed militias are preparing to attack U.S. bases in Iraq, and possibly Syria'","Naval facility","","","STRIKE;SY;SYRIA;US","enriched","FALSE","FALSE","FALSE","FALSE"
"tw-20250622152004-iran-unk","Independent Actions","Iranian state television says air defense systems shot down an Israeli Hermes 900…","Jun 22, 2025","economic","drone","FALSE","","","","","32.0","53.0","Iran","","Iranian state television says air defense systems shot down an Israeli Hermes 900 drone","Air defense / TEL","UAV / Drone","","DRONE;IR;IRAN","enriched","FALSE","FALSE","FALSE","FALSE"
"tw-20250622172002-israel-iranre","Iran Retaliation","Iran launches new wave of missiles at Israel","Jun 22, 2025","strike","missile","FALSE","32.0","53.0","Iran / Proxy Forces","IRGC launch sites","31.5","34.9","Israel","","Iran launches new wave of missiles at Israel","Area / Infrastructure","Ballistic / Cruise Missile","","IL;IRAN;IRAN-RETALIATION;ISRAEL;MISSILE","enriched","FALSE","FALSE","FALSE","FALSE"
"tw-20250622173002-israel-unk","Independent Actions","Iran fired only a single ballistic missile at Israel during its latest attack","Jun 22, 2025","strike","missile","FALSE","","","","","31.5","34.9","Israel","","Iran fired only a single ballistic missile at Israel during its latest attack","Area / Infrastructure","Ballistic / Cruise Missile","","IL;IRAN;ISRAEL;MISSILE","enriched","FALSE","FALSE","FALSE","FALSE"
"tw-20250622192003-iran-unk","Independent Actions","Trump says strikes on Iran achieved their goals","Jun 22, 2025","strike","strike","FALSE","","","","","32.0","53.0","Iran","","Trump says strikes on Iran achieved their goals","Military target","","","IR;IRAN;STRIKE","enriched","FALSE","FALSE","FALSE","FALSE"
"tw-20250622233002-iran-12dayw","12-Day War (IDF)","Israeli military says it struck six Iranian airbases and destroyed 15 aircraft…","Jun 22, 2025","strike","fighter","FALSE","31.9","34.8","Israel (IAF)","Israeli Air Force bases","32.0","53.0","Iran","","Israeli military says it struck six Iranian airbases and destroyed 15 aircraft and helicopters","Military base / C2","Multi-role Fighter Aircraft","","12-DAY-WAR-(IDF);FIGHTER;IR;IRAN","enriched","FALSE","FALSE","FALSE","FALSE"
"tw-20250623002003-israel-iranre","Iran Retaliation","Iran launches new missile strike on Israel","Jun 23, 2025","strike","missile","FALSE","32.0","53.0","Iran / Proxy Forces","IRGC launch sites","31.5","34.9","Israel","","Iran launches new missile strike on Israel","Area / Infrastructure","Ballistic / Cruise Missile","","IL;IRAN;IRAN-RETALIATION;ISRAEL;MISSILE","enriched","FALSE","FALSE","FALSE","FALSE"
"tw-20250623014002-iran-iranre","Iran Retaliation","New Iranian ballistic missile attack on Israel","Jun 23, 2025","strike","missile","FALSE","32.0","53.0","Iran / Proxy Forces","IRGC launch sites","32.0","53.0","Iran","","New Iranian ballistic missile attack on Israel","Area / Infrastructure","Ballistic / Cruise Missile","","IR;IRAN;IRAN-RETALIATION;ISRAEL;MISSILE","enriched","FALSE","FALSE","FALSE","FALSE"
"tw-20250623020004-tehran-unk","Independent Actions","Israeli military says it is striking government targets in Tehran with…","Jun 23, 2025","strike","strike","FALSE","","","","","35.69","51.39","Tehran","","Israeli military says it is striking government targets in Tehran with 'unprecedented intensity'","Military target","","","IR;STRIKE;TEHRAN","enriched","FALSE","FALSE","FALSE","FALSE"
"tw-20250623025007-fordow-opmidn","Op. Midnight Hammer","Israel has bombed the road to Fordow nuclear facility","Jun 23, 2025","economic","nuclear","FALSE","-7.32","72.42","Diego Garcia BIOT","US/UK forward base","34.88","50.49","Fordow","","Israel has bombed the road to Fordow nuclear facility","Nuclear facility","Strike Aircraft / Cruise Missile","","FORDOW;IR;ISRAEL;NUCLEAR;OP-MIDNIGHT-HAMMER","enriched","FALSE","FALSE","FALSE","FALSE"
"tw-20250623025008-iran-12dayw","12-Day War (IDF)","Israeli military is bombing headquarters of Iranian Revolutionary Guards","Jun 23, 2025","strike","fighter","FALSE","31.9","34.8","Israel (IAF)","Israeli Air Force bases","32.0","53.0","Iran","","Israeli military is bombing headquarters of Iranian Revolutionary Guards","Military base / C2","Multi-role Fighter Aircraft","","12-DAY-WAR-(IDF);FIGHTER;IR;IRAN","enriched","FALSE","FALSE","FALSE","FALSE"
"tw-20250623030002-tehran-unk","Independent Actions","Israel bombs a power supply system in Tehran","Jun 23, 2025","strike","fighter","FALSE","","","","","35.69","51.39","Tehran","","Israel bombs a power supply system in Tehran","Military target","Multi-role Fighter Aircraft","","FIGHTER;IR;ISRAEL;TEHRAN","enriched","FALSE","FALSE","FALSE","FALSE"
"tw-20250623030003-iran-opepic","Op. Epic Fury","Israeli media reports that hundreds of members of Iranian Revolutionary Guards…","Jun 23, 2025","strike","strike","FALSE","-7.32","72.42","Diego Garcia BIOT","US/UK forward base","32.0","53.0","Iran","","Israeli media reports that hundreds of members of Iranian Revolutionary Guards have been killed in strikes on Tehran","Naval facility","","","IR;IRAN;OP-EPIC-FURY;STRIKE","enriched","FALSE","FALSE","FALSE","FALSE"
"tw-20250623031002-israel-unk","Independent Actions","Israeli military has bombed the headquarters of the Basij as well as Evin prison","Jun 23, 2025","strike","fighter","FALSE","","","","","31.5","34.9","Israel","","Israeli military has bombed the headquarters of the Basij as well as Evin prison","Military base / C2","Multi-role Fighter Aircraft","","FIGHTER;IL;ISRAEL","enriched","FALSE","FALSE","FALSE","FALSE"
"tw-20250623040004-fordow-opmidn","Op. Midnight Hammer","Israeli military says it struck routes leading to Fordow nuclear site","Jun 23, 2025","economic","nuclear","FALSE","-7.32","72.42","Diego Garcia BIOT","US/UK forward base","34.88","50.49","Fordow","","Israeli military says it struck routes leading to Fordow nuclear site","Nuclear facility","Strike Aircraft / Cruise Missile","","FORDOW;IR;NUCLEAR;OP-MIDNIGHT-HAMMER","enriched","FALSE","FALSE","FALSE","FALSE"
"tw-20250623042002-tehran-opepic","Op. Epic Fury","Israeli military says it carried out over 100 strikes in Tehran over the past two…","Jun 23, 2025","strike","strike","FALSE","-7.32","72.42","Diego Garcia BIOT","US/UK forward base","35.69","51.39","Tehran","","Israeli military says it carried out over 100 strikes in Tehran over the past two hours","Military target","","","IR;OP-EPIC-FURY;STRIKE;TEHRAN","enriched","FALSE","FALSE","FALSE","FALSE"
"tw-20250623122003-qatar-unk","Independent Actions","US officials confirm none of the ballistic missiles fired by Iran actually…","Jun 23, 2025","strike","missile","FALSE","","","","","25.35","51.18","Qatar","","US officials confirm none of the ballistic missiles fired by Iran actually impacted US base in Qatar","Area / Infrastructure","Ballistic / Cruise Missile","","IRAN;MISSILE;QA;QATAR;US","enriched","FALSE","FALSE","FALSE","FALSE"
"tw-20250623123003-qatar-unk","Independent Actions","Iran coordinated missile attack US base in Qatar with Qatari officials and gave…","Jun 23, 2025","strike","missile","FALSE","","","","","25.35","51.18","Qatar","","Iran coordinated missile attack US base in Qatar with Qatari officials and gave advanced notice in attempt to minimize casualties, according to New York Times report.","Naval facility","Ballistic / Cruise Missile","","IRAN;MISSILE;QA;QATAR;US","enriched","FALSE","FALSE","FALSE","FALSE"
"tw-20250623125002-qatar-unk","Independent Actions","Widespread condemnation in Arab World over Iran's missile attack against US base…","Jun 23, 2025","strike","missile","FALSE","","","","","25.35","51.18","Qatar","","Widespread condemnation in Arab World over Iran's missile attack against US base in Qatar","Area / Infrastructure","Ballistic / Cruise Missile","","IRAN;MISSILE;QA;QATAR;US","enriched","FALSE","FALSE","FALSE","FALSE"
"tw-20250623140004-tehran-unk","Independent Actions","Israeli military evacuation orders for part of Tehran","Jun 23, 2025","strike","strike","FALSE","","","","","35.69","51.39","Tehran","","Israeli military evacuation orders for part of Tehran","Military target","","","IR;STRIKE;TEHRAN","enriched","FALSE","FALSE","FALSE","FALSE"
"tw-20250623145002-iran-12dayw","12-Day War (IDF)","Reports of large number of Israeli fighter jets flying eastward into Iranian air…","Jun 23, 2025","strike","fighter","FALSE","31.9","34.8","Israel (IAF)","Israeli Air Force bases","32.0","53.0","Iran","","Reports of large number of Israeli fighter jets flying eastward into Iranian air space, amid evacuation orders.","Naval facility","Multi-role Fighter Aircraft","","12-DAY-WAR-(IDF);FIGHTER;IR;IRAN","enriched","FALSE","FALSE","FALSE","TRUE"
"tw-20250623151002-tehran-opepic","Op. Epic Fury","Massive blasts in Tehran as Israel conducts large strikes","Jun 23, 2025","strike","strike","FALSE","-7.32","72.42","Diego Garcia BIOT","US/UK forward base","35.69","51.39","Tehran","","Massive blasts in Tehran as Israel conducts large strikes","Military target","","","IR;ISRAEL;OP-EPIC-FURY;STRIKE;TEHRAN","enriched","FALSE","FALSE","FALSE","FALSE"
"tw-20250623155002-tehran-unk","Independent Actions","Israeli military widens Tehran evacuation orders","Jun 23, 2025","strike","strike","FALSE","","","","","35.69","51.39","Tehran","","Israeli military widens Tehran evacuation orders","Military target","","","IR;STRIKE;TEHRAN","enriched","FALSE","FALSE","FALSE","FALSE"
"tw-20250623161002-israel-unk","Independent Actions","Israeli military spokesman declines to comment on Trump's ceasefire statement","Jun 23, 2025","strike","strike","FALSE","","","","","31.5","34.9","Israel","","Israeli military spokesman declines to comment on Trump's ceasefire statement, according to the New York Times.","Military target","","","IL;ISRAEL;STRIKE","enriched","FALSE","FALSE","FALSE","FALSE"
"tw-20250623163001-tehran-opepic","Op. Epic Fury","Reports of possible assassination strike in Tehran","Jun 23, 2025","strike","strike","FALSE","-7.32","72.42","Diego Garcia BIOT","US/UK forward base","35.69","51.39","Tehran","","Reports of possible assassination strike in Tehran","Naval facility","","","IR;OP-EPIC-FURY;STRIKE;TEHRAN","enriched","FALSE","FALSE","FALSE","TRUE"
