"created_at","full_text","categories","countries","operations","is_breaking"
"2024-11-26 23:15:03","BREAKING: Lebanon's army tells displaced not to return to frontline villages until Israeli troops withdraw","military_operations;casualties_humanitarian","IL;LB","","TRUE"
"2024-11-19 03:05:22","BREAKING: 8 killed in stabbing attack at vocational school in eastern China","military_operations;casualties_humanitarian","CN","","TRUE"
"2023-06-28 10:35:01","BREAKING: Gunman opened fire and killed a guard outside US Consulate in Jeddah, Saudi Arabia, before being shot dead himself.","casualties_humanitarian","SA","","TRUE"
"2023-06-26 03:15:01","The AFP reports that nine civilians, including two children, killed in Russian airstrikes on a fruit and vegetable market in northwest Syria.","military_operations;casualties_humanitarian","RU;SY","","FALSE"
"2023-06-23 15:45:00","BREAKING: Wagner Group chief says Russia must be liberated from 'people who are killing civilians'","military_operations;casualties_humanitarian","RU","Russia-Ukraine War","TRUE"
"2023-06-23 08:20:01","BREAKING: Russia's Wagner Group chief says a 'huge' number of his forces were killed in attack by Russian military, vows revenge.","military_operations;casualties_humanitarian","RU","Russia-Ukraine War","TRUE"
